{
  "schema_version": "vvfp.expanded_256_stored_index_evidence.v1",
  "contract_id": "x45-vv4-vv5-expanded-256-stored-index-evidence",
  "status": "static_partial_stop",
  "integrity": {
    "canonicalization": "UTF-8 JSON with sorted keys and compact separators; integrity.canonical_sha256 is excluded from its own digest",
    "canonical_sha256": "13D4E2AF89EDACD7C20CAFDFD407ECC5D1C34DEE3C1BA53A7FE4121087698DFE"
  },
  "publication": {
    "enabled": false,
    "runtime_go": false,
    "player_go": false,
    "eligible": false,
    "reason": "No complete VV4/VV5 stored-index path ledger, full-folder fingerprint, authenticated runtime capture, or proof that every path accepts record 255 while excluding indices 256-259 is present."
  },
  "evidence_policy": {
    "required_categories": [
      "selection",
      "roster",
      "detail",
      "queue_actions",
      "pairing_pregnancy",
      "birth_death",
      "skeleton_memorial",
      "events_puzzles",
      "statistics",
      "callbacks",
      "serializer_load_catchup"
    ],
    "required_observed_row_fields": [
      "path_id",
      "category",
      "function_name",
      "function_ea",
      "instruction_ea",
      "operand_file_offset",
      "operand_width_bits",
      "storage_width_bits",
      "sentinel",
      "xrefs",
      "record_255",
      "indices_256_259",
      "runtime_receipt_refs",
      "source",
      "synthetic"
    ],
    "completion_rule": "Every required category must be observed_complete with one or more exact evidence rows, an observed exact full-folder fingerprint, an authenticated runtime-capture receipt, record 255 accepted, and indices 256-259 unreachable and non-saveable. Any unknown or partial path is STOP.",
    "byte_ff_rule": "A byte-sized 0xFF value is ambiguous when record 255 is valid. An 8-bit stored record index using 0xFF as no-record is STOP until widened or proven not to store a record index.",
    "synthetic_evidence": "forbidden",
    "manual_field_injection": "forbidden",
    "vv5_generalization": "The cited VV5 DWORD/-1 fragments apply only to their named paths and may not be projected onto VV4 or any unenumerated VV5 path."
  },
  "source_provenance": {
    "design_assignment": "X45-STORED-INDEX-EVIDENCE-GATE",
    "implementation_base_commit": "03bbfe4957edf6fbf995a251ff395d1ff6d5f374",
    "schema": {
      "path": "data/schemas/expanded_256_stored_index_evidence.schema.json",
      "sha256": "130E687C3C93FEFE2E33DCAFE4FFF2B8EECBB253EC28AA89D479127432010981"
    },
    "source_files": [
      {"path": "data/expanded_256.json", "sha256": "5738EABD414DA0171C8A03316B9CCCE9C39CF8F080D63D2F209D9A5C7A5DEAB3"},
      {"path": "data/expanded_256_runtime_evidence.json", "sha256": "BB90E24579DB33A118779A2EACC939D96DDCD8392C9C759CB9B373B8DFEB4DF3"},
      {"path": "scripts/capture_expanded_runtime_evidence.py", "sha256": "719DAD95AC6AB2D2E1CC9F64DECF1BB894CC4A98B5B7662A3A84402B2C5CA321"},
      {"path": "data/vv4_origins_feature.json", "sha256": "A38F98973EB83F91D60FCA5C2A1BD28444622CEAC5434C295FB7E73D3A1BCB71"},
      {"path": "data/vv5_origins_feature.json", "sha256": "6AFF1A8E69234C61CB2D1878C46FA91B0AAA721FC5F29C5B42A678F61BAB8528"}
    ]
  },
  "games": {
    "vv4": {
      "stock_fingerprint": {
        "filename": "Virtual Villagers - The Tree of Life.exe",
        "size": 929792,
        "sha256": "6D27A429FFCA5F1F71FDD7ECA761ED1BB67E85F976494BA178B3D7BE01F1B220"
      },
      "full_folder_fingerprint": {
        "status": "absent_stop",
        "inventory_schema": "vvfp.runtime_capture_folder_inventory.v1",
        "required_role_count": 9,
        "canonical_inventory_sha256": null,
        "runtime_receipt_sha256": null
      },
      "runtime_capture_binding": {
        "schema_version": "vvfp.expanded_256_runtime_capture.v1",
        "harness_path": "scripts/capture_expanded_runtime_evidence.py",
        "harness_sha256": "719DAD95AC6AB2D2E1CC9F64DECF1BB894CC4A98B5B7662A3A84402B2C5CA321",
        "contract_canonical_sha256": "44006789E82B4C92C9940B8B33ED3AFDFCA45EB25DF774F22156AEF9FF7392E8",
        "status": "absent_stop",
        "capture_packet_sha256": null,
        "authenticated": false
      },
      "relocation_ledger": {
        "path": "data/vv4_origins_feature.json",
        "json_pointer": "/expanded_shr_relocations/patches",
        "count": 13,
        "ledger_sha256": "CEE01F4AEC59CB1CEE0F42E3DDDB3A24615261E628ED0629C1BFAABF421A897D"
      },
      "layout_boundary": {
        "logical_records": 256,
        "physical_records": 256,
        "padding_records": 0,
        "record_255": {"layout_state": "allocated", "path_acceptance_proof": "partial_static_stop"},
        "indices_256_259": {"layout_state": "outside_record_pool", "unreachable_proof": "absent_stop", "non_saveable_proof": "absent_stop"}
      },
      "index_model": {
        "status": "unknown_stop",
        "storage_width_bits": null,
        "sentinel": null,
        "cited_static_fragments": [],
        "generalizable_from_vv5": false
      },
      "candidate_static_edits": [
        {"id": "vv4-edit-0x66045", "category": "selection", "manifest_offset": "0x66045", "manifest_row_sha256": "CFD28D400289D3907419C7848B815B195E3A864A36343CEDDE0FF14B6AEEE465", "qualifying_evidence": false},
        {"id": "vv4-edit-0x6683f", "category": "selection", "manifest_offset": "0x6683F", "manifest_row_sha256": "1EAACEAD79AA90339815D1FBA556716ADB8C830DB67A1CEDFFB8AD0DBED63946", "qualifying_evidence": false},
        {"id": "vv4-edit-0x66845", "category": "selection", "manifest_offset": "0x66845", "manifest_row_sha256": "3D32E24B66D575F6A663EE7A26C76C2E71A09C2682E6CBE694DE4C9954CC112B", "qualifying_evidence": false},
        {"id": "vv4-edit-0x66a0f", "category": "selection", "manifest_offset": "0x66A0F", "manifest_row_sha256": "9BFCDF51C425954EF7C2BB36BC59D83A24C52040A83F43AE0E8B04E4ACBB2BB3", "qualifying_evidence": false},
        {"id": "vv4-edit-0x66a15", "category": "selection", "manifest_offset": "0x66A15", "manifest_row_sha256": "23B99BAF9F7F782EF056D62155B9EA37E94F2679A59DF54DEC29AF8ED87857C9", "qualifying_evidence": false},
        {"id": "vv4-edit-0x66ae0", "category": "selection", "manifest_offset": "0x66AE0", "manifest_row_sha256": "7F2A48DBB9B4F8C4C96999EDFBBD415995B1D82904A8A10CB5D3BD102BB11858", "qualifying_evidence": false},
        {"id": "vv4-edit-0x66ae6", "category": "selection", "manifest_offset": "0x66AE6", "manifest_row_sha256": "B3B2CDC29C488B12D5A6FD3BC3C600D734EFB47652DE5DD7A579CFCD3B1C3FBF", "qualifying_evidence": false},
        {"id": "vv4-edit-0x669cc", "category": "selection", "manifest_offset": "0x669CC", "manifest_row_sha256": "35A10F153A8D8FEF154F1851A19044A49C204C224B4EAB0F6DF638DA775D4A9D", "qualifying_evidence": false},
        {"id": "vv4-edit-0x66e6f", "category": "selection", "manifest_offset": "0x66E6F", "manifest_row_sha256": "C9D392B640873B1E26A035D08F60557A17AE89D68542D7BF3737818DA2E7A710", "qualifying_evidence": false},
        {"id": "vv4-edit-0x66f11", "category": "selection", "manifest_offset": "0x66F11", "manifest_row_sha256": "94EAF736E97EA9D62724FAAACCE063D71B5820B51D11EB5CFDCEE36F0820929D", "qualifying_evidence": false},
        {"id": "vv4-edit-0x66c9c", "category": "selection", "manifest_offset": "0x66C9C", "manifest_row_sha256": "75A1C9F1B9CC8065D2E9FC95069B343B0F4D281420E677822B5735F9D26834DC", "qualifying_evidence": false},
        {"id": "vv4-edit-0x1fc19", "category": "serializer_load_catchup", "manifest_offset": "0x1FC19", "manifest_row_sha256": "948EFA9931C3E1C9D8F70DA1365A523B1D13FF77C234D2F3159E5182CD8412A3", "qualifying_evidence": false},
        {"id": "vv4-edit-0x8910d", "category": "serializer_load_catchup", "manifest_offset": "0x8910D", "manifest_row_sha256": "B48FAC5E6A32C2DFB78A2FB63F6C9834CB8706612A32DC46B63593E8CB724E30", "qualifying_evidence": false}
      ],
      "path_categories": [
        {"category": "selection", "status": "partial_static_stop", "candidate_edit_refs": ["vv4-edit-0x66045", "vv4-edit-0x6683f", "vv4-edit-0x66845", "vv4-edit-0x66a0f", "vv4-edit-0x66a15", "vv4-edit-0x66ae0", "vv4-edit-0x66ae6", "vv4-edit-0x669cc", "vv4-edit-0x66e6f", "vv4-edit-0x66f11", "vv4-edit-0x66c9c"], "expected_path_count": null, "path_ledger_sha256": null, "evidence_rows": [], "missing_evidence": ["exact function/instruction/operand-width/sentinel/xref ledger", "authenticated late-record and rejection receipts"]},
        {"category": "roster", "status": "unknown_stop", "candidate_edit_refs": [], "expected_path_count": null, "path_ledger_sha256": null, "evidence_rows": [], "missing_evidence": ["complete exact path ledger and runtime receipts"]},
        {"category": "detail", "status": "unknown_stop", "candidate_edit_refs": [], "expected_path_count": null, "path_ledger_sha256": null, "evidence_rows": [], "missing_evidence": ["complete exact path ledger and runtime receipts"]},
        {"category": "queue_actions", "status": "unknown_stop", "candidate_edit_refs": [], "expected_path_count": null, "path_ledger_sha256": null, "evidence_rows": [], "missing_evidence": ["complete exact path ledger and runtime receipts"]},
        {"category": "pairing_pregnancy", "status": "unknown_stop", "candidate_edit_refs": [], "expected_path_count": null, "path_ledger_sha256": null, "evidence_rows": [], "missing_evidence": ["complete exact path ledger and runtime receipts"]},
        {"category": "birth_death", "status": "unknown_stop", "candidate_edit_refs": [], "expected_path_count": null, "path_ledger_sha256": null, "evidence_rows": [], "missing_evidence": ["complete exact path ledger and runtime receipts"]},
        {"category": "skeleton_memorial", "status": "unknown_stop", "candidate_edit_refs": [], "expected_path_count": null, "path_ledger_sha256": null, "evidence_rows": [], "missing_evidence": ["complete exact path ledger and runtime receipts"]},